0,100970772473987072,,,25596014,@RyanRuocco but let Sanchez get through his 3rd season before we say if he's better then eli
0,103883705264783360,,,287201811,"@MattBedfordd Well I've got to sort out hotels etc for when I'm in Derby tonight, but I'll stay updated! Cesc to score the winner?"
0,104742390924972033,,,106681745,Da way aaron rodgers lookin greenbay may take it again
0,100047699386187776,,,41979267,"@letmeRyed o ok, well i'm not coming back to dallas tonight"
0,100291288888389632,,,41248640,Revis bats down Sanchez pass to Holmes. 3rd PBU by 24 in 2days. Holmes makes up 4 it with catch on Cromartie on next play. #nyj
0,101497762343948288,,,15631549,"[Tigernet] Wednesday football practice videos: Videos from Clemson's fifth practice of the preseason, ... http://bit.ly/rg6DjJ #Clemson"
0,107628522297769984,,,225262215,Comedy central going IN tonight...
0,112656367495561216,,,14397367,#Guelph Nuit Blanche tonight: 1:30am. Bookshelf Cinema parking lot - CFRU's Silent Dance Party. http://bit.ly/nr0ryf
0,104275016975265792,,,19867507,@MickRathbone what do you think is happening at everton then Mick after today's speech by bill?
0,100259258456743936,,,15395631,QB/RB threat Blake Sims may be just offensive weapon Bama needs http://tinyurl.com/3cs74vw http://fb.me/17Td2ApmL
0,100123913681514496,,,188588411,Jackson back in camp Monday @ESPN_Colin you ready to see the Eagles lift up that trophy!
0,100892917752791040,,,45804205,WOW STI is off today since it's Singapore's Independence Day
0,100290340841455616,,,31941143,Revis bats down Sanchez pass to Holmes. 3rd PBU by 24 in 2days. Holmes makes up 4 it with catch on Cromartie on next play. #nyj
0,100590944558125057,,,101014684,I also had a dream last night that football season started and the Ravens were playing the steelers and Ray Rice was running all over them
0,100638299479216130,,,325200829,@Maryhlyon I'm going to auburn thursday now...
0,101935066871103488,,,316414019,Bolton Society for Blind People are bringing Vegas to Bolton with a Charity Dinner on 23 Sep http://bsbpvegasball.eventbrite.com/  Please RT xx #BSBP
0,118800010371530753,,,16204159,"CBS says commentator Andy Rooney will make his final weekly ""60 Minutes"" appearance on this Sunday's edition: http://apne.ws/oa8uQg  -RAS"
0,101665177153454081,,,217358836,"Since Tottenham's game against Everton was postponed, they will start the season against Man Utd at Old Trafford on 22 August. @xuanyi7"
0,100637319375224832,,,107145577,He smokes weed RT @TakeF_Light :O RT @ravensbuzztap Baltimore Sun >> Ravens agree to deal with Ricky Williams http://buzztap.com/-M81AWM
0,101136546928926720,,,31345791,Currently scheming with @wernickVT . Tech vs. Clemson in Blacksburg October 1st? I think yes. #oolegooo ! be prepared @vtrel. It may happen
0,100032185725227009,,,171372080,Q: What is the weather like in Italy in November? And is that a good time to travel there? #Italy #weather #iPad http://bit.ly/r0yrOe
0,112746230802694144,,,33290317,Ima fall asleep to some Family Guy tonight .
0,117577445380599808,,,22204289,Just realized it's Nuit Blanche the night before the Run For The Cure. I feel like I'm in a stare down. Who's gonna win?
0,101465421076643840,,,125774437,"Still going on vaca...: Still going on vaca...(Third column, 7th story, link)Related stories:OBAMA CONSIDERS BEC... http://bit.ly/nUqL1u"
0,114390835163971584,,,46846506,Also happening tonight: Nina Burleigh on the trials of Amanda Knox. At the New York City Bar Association. Details here: http://bit.ly/olJUmL 
0,100063087918452736,,,244725343,RT @discojr: All Roads LEAD to Santa Fe TONiGHT 1st Saturday Jamaican Independence Day... Disco JR live on the 1s & 2s
0,102765009830023168,,,236642926,"Today, life will be just like an episode of 60 Minutes...but with a young, cheerful Andy Rooney."
0,102479479095562241,,,128113392,"Got my Ole Miss season tickets today, question now is will they win any conference games. We are Bama fans so more about seeing daughter."
0,103384147820679168,,,144898981,Do you like data? Are you in Bangalore? India? Well come and chat with me and @mayameme at Matteo on Church st tomorrow at 6pm. #datameet
0,100061423287287808,,,74368195,@A_Bautista26 Wow really? I go to Mexico every December to spend the holidays over there.(:
0,101060532831911936,,,115281630,O yea btw imma be in Clemson on Thursday...I tryna get a early nigga knock going on
0,100017748008112128,,,216779572,Premium Version of the IPad 2 May Be in the Works http://goo.gl/fb/kmD8b
0,103854482076614656,,,111551646,"Tired! Out for a meal in a bit, day off work tomorrow. Then last day on Friday! DERBY...: http://yearbook.com/a/1mij5f"
0,100576188094881792,,,21684283,"Awaiting update on Mikel Leshoure's injury. But so far, WR Titus Young is the only one of the Lions top three picks in April still standing."
0,100967212612980737,,,57501454,"RT @nyjets: This afternoon's Jets training camp practice will be closed to the public due to heavy storms heading toward Florham Park, NJ"
0,100623451034890240,,,190115208,I may get Showtime for Dexter and cancel after it is over. October 2nd!
0,100169294356283392,,,23570639,"Leaving now for the long drive to Detroit, had about 3 hours of sleep after Chicago last night, but wide awake! See some of you tonight!!!"
0,101784327792246785,,,18328219,Word RT @K_Mapp: Smh RT @da_underdog: <==== Broncos fan for the night! I hope Tony Romo gets sacked at least 15 times. #Thatisall
0,101103966657581056,,,16530805,@AccessWinnipeg Thanks for the heads up on the SportChek 50% off Jets promo. Got some gear tonight.
0,100665263426519040,,,52609331,"#sportsnation just ranked Auburn as the 4th best team in #SEC with Arkansas at 5. If AU wins 3 league games, a surprise. @ESPN_Colin #awful"
0,100257844087103488,,,343682066,Going to McAlester today...Bama bound early in the am! Torn!
0,101150293483466752,,,240220045,WSOC dispatched Nebraska today & landed at #1 in a preseason poll - check out the action and interviews from today - http://www.und.com/allaccess/?media=254686 …
0,101151693613436928,,,17167419,2 Democrats in Wisconsin state senate up for recall election next Tuesday. Hopefully the discouragement of Waukesha doesn't prevail.
0,111487830869553152,,,311048818,. http://bit.ly/q3oLic  To do tonight: See The Help in theater amanda knox
0,103036470260006914,,,31700937,"@simongreening Morning Simon, r u going to see Cowboys and Aliens preview on Monday or Tuesday at Lpool ONE?"
0,100108937193455616,,,311895841,Coverage of high quality stakes races from The Curragh posted to my blog soon. Good value bets on offer across the UK & Ireland for Sunday.
0,116354290154602497,,,118215763,"North House does Nuit Blanche - We're going to map a route, and get out for a night of city walking... http://progdb.com/p/6BY"
0,100744274857046017,,,273499762,@lawsonVFL @Timmyhbass today I told a bed-ridden old man wearing Clemson pants that the rest of his team would be joining him soon
0,100335210192834562,,,3332001,"Longline bras hurt to dance in, I can drive in wellies, a white haired man has never left the #iom, merlin was a saucy old sorcerer. Night."
0,100636341393559552,,,334857939,Internship Website Launched in Nebraska: Nebraska Governor Dave Heineman today announced the launch of a new web... http://bit.ly/puZdEw
0,100136834306277376,,,291128413,"Went looting in Spurs last night, broke into the White Hart Lane cabinet, so left with a pile of dust and a Gareth Bale DVD."
0,103943759443660800,,,310287143,Divine frame & @PerFect_10_ presents the official south Alabama football season kick off @ club insanity September 1st
0,100544750414864384,,,38412163,"@iheardavoicesay is finally catching up to me with #Dexter. I'm only up to season 4, but he has almost finished season 2 today @ home, ill."
0,100003164631207936,,,304231752,@murphylee r yall going to be in dallas friday & saturday?
0,100139342198087680,,,67628449,"RT @Sportsworldokon: RT @ColinUdoh: Nigeria play England in the Round of 16 on Wednesday 10th, at 11PM Nigeria time #U20WorldCup"
0,112579532099289088,,,85667198,Here until 2pm today! Then Romo is off to skate with the Saint Lunachix vs St. Chux Derby Chix at Queeny Park tonight!
0,100106756562223104,,,30235138,"see you tonight #Echelonfamily,time to drive back to Milan!"
0,100576050723033088,,,153628928,"@vincefoss According to reporters on the scene at practice, Lions rookie RB Mikel Leshoure was carted off field today with a left leg injury"
0,100153656527175680,,,19448397,@Wobler_ 3 months free ESPN given to anyone. Got a letter through the post yesterday.
0,100351661167480833,,,334864399,"Time to head to the beach at the river's edge. My Wife is there, and the Fish are there, and the Eagles and Frogs and Sun are all there...."
0,103353544115105792,,,266554089,"rally at gandhi statue, marina beach at 5 PM today. join the IACC & show your solidarity with anna hazare. pls RT & make a difference."
0,100985699037229056,,,207835030,"QFE: And we must do it again tomorrow. By @TonyKatz: Gandhi, The Tea Party and the Future of Americahttp://pajamasmedia.com/tatler/2011/08/09/gandhi-the-tea-party-and-the-future-of-america/ …"
0,101843033070383104,,,350563696,Purples and Football at Baby A's with my Aunt and Cousin. ready to see my JETS play on monday ;)
0,101679633073836032,,,175444781,You work? RT @SavageBeaute: Going to walk the Brooklyn Bridge today
0,100018849310715904,,,124052077,"@ABestwickESPN Knowing you are a Red Sox fan, who will win the rubber game tomorrow? Go Yankees! LOL"
0,101089431011868672,,,317801897,#winnipegjets Bogosian ready to bring it on with Jets - Winnipeg Sun http://ow.ly/1eaKQ3
0,100681424830607360,,,301591926,"THIIISSSS MOFO wants me to go to Auburn's 1st day of practice, I'm going to be the only person booing!"
0,100153138018926592,,,25985436,Was last night in Tottenham part of Spurs plan to get more money from the mayors office for the new stadium??
0,101378252697899008,,,246820116,"Rumors say it is ""Tangled"" and it may replace Beauty and the Beast at Studios and Aladdin at DCA. Just a rumor for now..."
0,113046984293744640,,,164923299,Amen RT @LeonKilledParis May the Universe guide Tony Romo's arms and eyes toward Jason Witten. And May Jason (cont) http://tl.gd/d1kdr2
0,106434923283484672,,,198451903,Comedy Central RT @Lord_Sugar What channel is Arsenal game on tonight
0,105075429332877312,,,15055813,"Remember that Janet Devlin girl on tonight's X Factor, the 'obviously in the final 12' one? She has a Youtube channel:http://www.youtube.com/user/janetdevlin#p/u/7/KVatQVYd1tE …"
0,101739051870195713,,,47502560,"If you want to see an exciting finish to the 2005 UT at Bama game, check out CSS right now. 4th quarter 3-3."
0,100532620114403328,,,75382384,Cowboys @ Jets will be the first late night game on Sunday on Channel 4 (via @j_hussain). Will be an emotional occasion on 9/11 anniversary.
0,111809650726408192,,,230337341,"@YahooNoise I have to go Romo, all have is Peyton who I got in the #10th Round. I think I was drafting against elementary children."
0,118799675598979072,,,32613440,"Andy Rooney, 92, will make last appearance on CBS' '60 Minutes' this Sunday - TVNewser http://bit.ly/rrHDjv"
0,100092592162738176,,,56693147,"Aglines roundup: Nebraskans may notice the ""Nebraska, Our Best to You"" logos in more locations across the state ... http://bit.ly/mPZ234"
0,101450941458423808,,,14475875,"Huntzinger struggles in the 5th, gives up first 2 BBs of outing, strands both runners w/ fly out by #9 hitter, Sanchez. #SeaDogs down 1-0"
0,101783736076607488,,,78569026,"The Wisconsin 14 Fought for You, Now it's Time to Fight for Them! Vote Holperin & Wirch This Tuesday, August 16th! #WIunion #wirecall #p2"
0,100016387854053376,,,298042956,lol cause we went to the zoo today & saw lions and tigers and all lat
0,106435132289843200,,,91995755,Comedy Central RT @Lord_Sugar What channel is Arsenal game on tonight
0,118799701016453120,,,18322918,"End of an era RT @CharlesMBlow: RT @GMA: Andy Rooney, 92, will make his last regular appearance on @60Minutes this Sunday CBS just announced"
0,100743961425084416,,,148468128,"RT @JasonLaCanfora: Free agent WR Jerricho Cotchery, traveling to Baltimore tonite to begin visit with Ravens. Visited Pitt recently"
0,101692814240399360,,,40271640,The JumpStart students walk the Brooklyn Bridge & end the night Bieber style. http://fb.me/uWtLN0MU
0,100047265045020673,,,19046694,"Looks like sports teams owners r studying the Congressional playbook. 1st the NFL, now the NBA, lock out players/threatening the season."
0,113047215064367104,,,75111267,Watching Cowboys/Jets game...let's see what Romo is going to do tonight...
0,104199651099549697,,,32127518,Cowboys vs Chargers on the practice field today and tomorrow. Play Sunday night 7:00 pm central at Cowboys Stadium.
0,100727735336439808,,,212124501,I wanted to see Columbiana for my birthday but it comes out on the 26th *rolls eyes* Guess ill go see it in Clemson.
0,115131753341009920,,,2605681,I hope Melissa McCarthy gets an Emmy tonight.
0,100001250887741441,,,54756059,"@ashaLadawn yeah, Imma be in vegas from 18th-23rd so I just want a dinner in dallas with friends"
0,100137570700234752,,,121020885,"Sunday's Lovely Gossip: Fabregas to pay his way out of Arsenal, the boy Alex to arrive soon, Crouch and Rodwell ... http://bit.ly/qaOtdb"
0,103111263281881088,,,121505689,"Tomorrow, people. RT @michellemalkin: Wisconsin Recall, Part Two: Fleebaggers face the music http://is.gd/RmAoIJ "
0,100711555901030401,,,24436600,@MerlinUWard Good evening Merlin. How are you?
0,101315206885552129,,,242633627,Come celebrate India's Independence Day at New Jersey's Official India Day Parade on August 14th 2pm Oak Tree Road in the Iselin sectio ...
0,100304265058320384,,,347108120,Arsenal submitted a bid this evening for Scott Dann. Look like the move to LFC I talked about may be about to turn complicated
0,100834520466595840,,,11804402,"tonight I dreamed of being in Orleans with the bus lines of Milan, and the IperCoop of Piazza Lodi instead of the Carrefour of Place d'Arc."
0,103506229216821250,,,61858272,"Tea Time at the James P. Nix Center, Thursday, August 18 ; 2 p.m. Topic: Birding in Coastal Alabama & the Alabama... http://fb.me/19spzh2Fy"
0,100984235078332416,,,17889378,listening to Springsteen's Nebraska album while driving through... well you can guess. @willknoxmusic's wishes. playing Lincoln tonight! 6PM
0,103929606834356224,,,237557034,@GulfCoastTider but he'll be on art bell tonight revealing the truth about the Alabama leprechaun.
0,100136934306873344,,,139469982,"Nigeria play England in the Round of 16 on Wednesday 10 August, at 11pm Nigeria time. Time to colonise England in football? #U20WorldCup"
0,112580927087050752,,,15684517,"The only dirty bombs on Sunday will be the ones launched by Mark ""Dirty"" Sanchez and the Jets as they pummel Romo's Homos #terror #nyj #wtc"
0,102901598912655360,,,52681749,Probably gonna spend the night watching that one episode of Merlin that loaded and the whole of Naruto Shippuden season 7.
0,100924196833591297,,,2752601,Notre Dame Women's soccer open their season today with a friendly vs Nebraska. Live web stream at 12pm Eastern http://tinyurl.com/3r6mkpe
0,103400539693395968,,,215613422,"RT @djlogansama: After Hours tonight - Jammin, Dimples, Durrty Skanx, Harry Shotta, Byron & Romo audio download: http://www.mediafire.com/?24fpc49591n92ga …> BIG!"
0,101934137597902848,,,316414019,@TheBoltonNews Pls RT - Bolton Society for Blind People are bringing Vegas to Bolton with a Charity Dinner on 23 Sephttp://bsbpvegasball.eventbrite.com/
0,113033961294401536,,,56499123,"Fantasy-wise, all I need is 4 TD's from Romo and 4 from Holmes tonight"
0,100003775439306752,,,20274544,"Auburn just wrapped up Saturday practice, interviews beginning shortly."
0,100170811985510400,,,295461841,"Leaving now for the long drive to Detroit, had about 3 hours of sleep after Chicago last night, but wide awake! See some of you tonight!!!"
0,103746924565372928,,,17679727,@RecoBeco The Inbetweeners Movie + Cowboys and Aliens are both out on mid-week release today. Either of those luring you through our doors?
0,100169850864930816,,,71777877,@Pip_Girl welcome to my usual dreams! :S Used to it by now. Other night was Merlin & Arthur & a dragon that was actually from Harry Potter.
0,100593691915329536,,,169306253,Tonight is Family Night at the Chick Fil A on Sparkleberry and Clemson. Get your face painted and a free kid's meal. 6-8pm
0,100152865456259072,,,209995842,And finally.. @billy_knott's dad says he will play 'with a point to prove' if he starts against Nigeria in #u20worldcup last 16 on Wednesday
0,118800431769067520,,,19288213,I've bitched enough. RT @AP: CBS says Andy Rooney to make his final weekly 60 Minutes appearance this Sunday: http://apne.ws/oa8uQg
0,100197350991081472,,,25446006,@mhigginsjets what are the rules regarding cameras & bags @ Jets stadium? I'll be @ the Cincy game on the 21st.
0,100200681968906240,,,244204216,Don't know if it's been reported but several members of Arsenal's U15 team had to be put in restraints after a late night brawl in Sweden
0,100000950005145600,,,18964685,"And on the very first play of the night, Aaron Rodgers is INT'd by UDFA CB Brandian Ross, who returns it for a pick-six touchdown."
0,103489733165989892,,,134971995,"Good Morning! ""Today Voters go to the Polls in Wisconsin's two Final Recalls"" | Reuters: http://reut.rs/pweg3e  #p2 #tcot #wirecall"
0,103307530184306688,,,134988013,"So Tomorrow Morning, wherever you are, think of us here in Wisconsin as we fight once again to restore Democracy to the Badger State."
0,108232170891509760,,,36597213,REGISTRATION IS NOW OPEN! Register for the professional event today (the Brooklyn Bridge walk is free) to grab... http://fb.me/16VNsyoi9
0,102009033367621633,,,20863771,One Jump Ahead on in the canteen: Seriously need to watch Aladdin tonight now!
0,100109015123640321,,,241116563,"#News SAIL may tie up with NFL for Rs 4,450-cr Sindri plant: ""NFL is the likely partner for SAI... http://bit.ly/oLwg8I @amitkarnani #AK"
0,101211547862441984,,,46187241,Some of the madness and mayhem the cast of Aladdin created when they flew into Newark on Monday!! http://fb.me/VNvs7llk
0,100227856155672576,,,163566302,Where have all the Yankees fans gone today? You were all so talkative before yesterdays game.
0,100757078703996928,,,143977321,@TerryFoster971 No one on the Lions has gotten injured today since Leshoure! Contract extensions all around! #bam
0,102720594092630016,,,310287143,get your tickets for the OFFICAL SOUTH ALABAMA FOOTBALL JUMPOFF!! only $5 !!!! Club insanity SEPT 1!!!
0,101934779318018048,,,316414019,@1074towerfm Pls RT Bolton Society for Blind People are bringing Vegas to Bolton with a Charity Dinner on 23 Sep http://bsbpvegasball.eventbrite.com/  #BSBP
0,103580552099135488,,,162545313,"Church member told me mtg tomorrow @ 1st Baptist is ""BYOB"". Asked if he told them 2nd 'B' didn't mean 'brownbag' in our church. He laughed."
0,105227112306327552,,,73225701,"Was asked today if Everton's display against QPR could be regarded as ""a cushions job"" - definitely one for the older generation that. #fb"
0,100741944627560449,,,254101362,"@JasonLaCanfora: Free agent WR Jerricho Cotchery, formerly of the Jets, traveling to Baltimore tonite to begin visit with Ravens. #whytho"
0,101468783788556289,,,158210406,"working on scouting report for Clemson vs. USF soccer exhibition on Friday, always on the job"
0,101347912482697216,,,336179955,"Do you want to be a Voodoo Derby Doll? After our ""Get Down and Derby"" night on Aug 26th at the Social Night Club... http://fb.me/FoYKrThp"
0,101194901470986240,,,155507264,@LaurenScottyXO oh there is no school today because yesterday is my country independence day so its a day off today. HAHA hby?
0,101228295659597824,,,277392430,More information on the new Comme des Garcons fragrance being launched at CHURCH next Wednesday (17th of August): http://churchgifts.blogspot.com/
0,100577145906135041,,,52105412,WOW. RT @AdamSchefter WR Titus Young is the only one of the Lions top three picks in April still standing.
0,100197905327075328,,,142725372,Football-Gunners wld always go on about Arsenal's white v Black composition.Today MUFC fields 7 black players.Difference is MUFC pays better
0,118393170227757056,,,19343479,Nuit Blanche is this weekend! Plan your night with the Personal Itinerary Planner: http://ow.ly/6DvSS @sbnuitblancheTO #snbTO
0,103641916586999808,,,285261101,"(OFF TOPIC) - there is only 3 episodes on the first disk of #Dexter. Please hurry, @netflix with the 2nd #fitblog"
0,100033572387303424,,,104942446,"Another double play helps Lafayette get out of sixth-inning trouble. Going to the bottom of the 6th, Lafayette 3, Mexico 3."
0,103081598597083137,,,102595585,The FA will be bringing a new interactive Road Show to Arsenal Ladies ahead of the game against Everton on Thursday
0,100092772228403200,,,178609244,RTRTRT @GreenDaySoul: RT if you love the song called last night on earth by Green Day.#IndoWantsGreenDay
0,100197265909616640,,,227533592,Im not watching them because the Red Sox vs Yankees game is on tonight for who's in first.
0,118800204911751168,,,19224100,"CBS says Andy Rooney will make his final weekly ""60 Minutes"" appearance on this Sunday's edition: http://apne.ws/oa8uQg  (via @AP)"
0,100140405458337792,,,94390273,...off to Milan...c ya on the 19th of August in Novi Sad with Silicon Soul and Fakir!!!
0,100170016875491328,,,21046881,Wonder if the Spurs shop got looted last night? #doubtit
0,100122523651407872,,,251766234,@TeenyEcosse Is there any improvement In the European weather. I need sun and heat. I have developed webbed feet here in Scotland!
0,100031060141813760,,,26358661,RT @espn ESPN MLB Cameron Maybin starting to see the sunhttp://es.pn/qClCtM 
0,100137775965282304,,,31219443,"LMAO RT @RichardKingson: Went looting in Spurs last night, broke into the White Hart Lane cabinet so left with a pile of dust and a Bale DVD"
0,111419511248400384,,,252260395,Amanda Knox Wins Another Round in Appeal: Amanda Knox won a skirmish today in the appeal of her murder convictio... http://bit.ly/oNq2tl
0,107490615557758976,,,64205103,Jumping off the Brooklyn Bridge with my hang glider on Sunday. Now taking bets on which state I land in.
0,100333309804023809,,,313039347,"BTN Football Practice Tour starts tomorrow. Leg 1 - Wisconsin, Minnesota, Iowa and Nebraska. I'll keep you updated. Stay in touch."
0,101829569757184003,,,55150066,I'm ready to see the Jets play Monday.
0,100757232685301760,,,67319480,"@lordhebe hours are 9:15 to 13:30 (GMT+1) for the public. As you're in Turin, they may refer you to the Milan embassy, and here's their...."
0,100152705753939968,,,81823101,Nigeria may parade a weakened team against Ghana on tuesday as most of the first players are yet to secure UK entry visas
0,101678437542006784,,,135560807,Former Cruz Azul player in the legendary 70s team and Mexican international Nacho Flores gunned down last night outside Mexico City.
0,101420646642368512,,,18069358,"If A&M does finally consummate the SEC romance, who would be the 14th SEC team? Has to be one of FSU, Clemson, Miami or Georgia Tech."
0,100108765185048576,,,93729965,"Hondo's bread on Fred: Hondo endured his customary Saturday night wipeout last night, crashing with the Yankees ... http://nyp.st/qUk28A"
0,103476400325013504,,,182015425,Today is National Bratwurst Day. Also another Recall Election day in Wisconsin. GET OUT THE BRAT! I mean VOTE! #WI #holiday #vote
0,101302841431429120,,,140615143,"Ideal weekend getaways: With Raksha Bandhan and Independence Day falling on Saturday and Monday this time, it ma... http://bit.ly/ntzCEC"
0,104186079791423488,,,297773417,"COWBOYS ! RT @AdamSchefter: NFL just declared Terrelle Pryor eligible for the supplemental that will take place Monday, Aug 22."
0,115749712660922368,,,111637825,"7 of the top 10 Search Engine referrals for TVE today are Mike & Molly related, thanks to Melissa McCarthy's win at the #Emmys!"
0,100623639849869313,,,32598066,Derrick Mason at the slot though? I can just hear it now... Sanchez to Mason...1st down..ANOTHER 3rd down conversion! All year... #Jets
0,104260383891660800,,,214355331,Cowboys tonight to see eli young band ;)
0,116158260196802560,,,16689815,I will be out of town and will miss this but you should go! Nuit Blanche #DC event Sept 24 http://www.artallnightdc.com/  @ArtAllNightDC
0,100108539397279745,,,37318060,"In Hastings, Nebraska, it's illegal to have sex without wearing a night shirt."
0,100500162224467968,,,137645230,"@missDCdarling We've got Leonardo da Vinci: Painter at the Court of Milan coming up in November, how does that sound? http://bit.ly/bPsEL2"
0,103671207999700992,,,17615946,"Can someone txt me/ @ reply me if we get any SWR related news tonight, I'll be at young adults at Church so no Internet."
0,103129157390704640,,,24168566,@limeflowertea ikr? Came across it randomly while doing my PR Clipping report this morning. The email contact is merlin @ merlinmedia...
0,100983624387670018,,,299863744,"Watched Aladdin on VHS last night, talk about high definition #stoneage"
0,100032906751258624,,,232942645,"I caught Adam Jones home run tonight, check me on ESPN top plays at Midnight! One handed w/ a soft pretzel in my hand on my iPhone"
0,100019340333678592,,,90225626,YNM - Did you see tonight's top ten best play on ESPN?
0,100016236217384961,,,55337142,RT @mckennaewen: I had a chance to show off the Star Tribune's new iPad app (launching Mon) on #tptAlmanac.Take a look! http://bit.ly/nRkSVh
0,100560700388278272,,,108618301,This is the binder Dexter picked out for 1st grade! http://yfrog.com/gzak0myj
